{
  "schemaVersion": 1,
  "workItemId": "8a4d2e3f-6c8b-4d9f-8b2c-3e4f5a6b7c8d",
  "route": "refuse",
  "turn": "rework",
  "reason": "work item 3e9b1f4a-2c6d-4e8f-9a0b-1c2d3e4f5a6b is still running on this pull request",
  "threadKey": "jamiegeddes/factorial#factorial/146b11c0-ca7d-11f1-9d6b-acd4bff0d455",
  "branch": "factorial/146b11c0-ca7d-11f1-9d6b-acd4bff0d455",
  "pullRequest": 87,
  "cause": "review",
  "previousWorkItemId": "146b11c0-ca7d-11f1-9d6b-acd4bff0d455",
  "refusal": { "status": "busy", "replied": true }
}
